{
  "$schema": "../../_schemas/hig_story_candidates.schema.json",
  "story_id": "us-15",
  "title": "корректные a11y-паттерны (VoiceOver/клавиатура/DT)",
  "role": "любой пользователь (в т.ч. с нарушениями зрения)",
  "value": "эффективно пользоваться приложением",
  "core_actions": [
    "Correct dialogs",
    "Dynamic Type & targets"
  ],
  "candidates": [
    {
      "action": "Dialogs focus & announcements",
      "pattern_id": "alert-focus",
      "title": "Alert with explicit focus & assertive live region",
      "hig_sections": [
        "Accessibility",
        "Feedback > Alerts"
      ],
      "swiftui_primitives": [
        "Alert",
        ".accessibilityFocused"
      ],
      "pros": [
        "Correct roles & focus; consistent copy"
      ],
      "cons": [
        "Alert-only"
      ],
      "accessibility_notes": [
        "Announce message; focus first actionable"
      ],
      "common_mistakes": [
        "Random focus order; vague copy"
      ],
      "scores": {
        "fit": 5,
        "load": 5,
        "consistency": 5,
        "accessibility": 5,
        "risk": 4,
        "total": 24
      },
      "refs": {
        "prd_ids": [
          "10",
          "11"
        ],
        "cjm_ids": [],
        "flow_nodes": [
          "report-sign",
          "error-entry-save"
        ],
        "user_story_id": "us-15"
      }
    },
    {
      "action": "Dynamic Type & targets",
      "pattern_id": "dynamic-type-44pt",
      "title": "System typography + min 44pt targets",
      "hig_sections": [
        "Typography",
        "Accessibility"
      ],
      "swiftui_primitives": [
        "Text(system fonts)",
        "Button"
      ],
      "pros": [
        "Global readability outdoors"
      ],
      "cons": [
        "Layout testing across sizes"
      ],
      "accessibility_notes": [
        "Respect larger type; avoid clipping"
      ],
      "common_mistakes": [
        "Fixed heights; color-only cues"
      ],
      "scores": {
        "fit": 5,
        "load": 5,
        "consistency": 5,
        "accessibility": 5,
        "risk": 4,
        "total": 24
      },
      "refs": {
        "prd_ids": [
          "10",
          "11"
        ],
        "cjm_ids": [],
        "flow_nodes": [
          "report-sign",
          "error-entry-save"
        ],
        "user_story_id": "us-15"
      }
    }
  ],
  "recommendation": {
    "best_fit": [
      "alert-focus",
      "dynamic-type-44pt"
    ],
    "rationale": "A11y as constraint baked into wireframes.",
    "refs": {
      "prd_ids": [
        "10",
        "11"
      ],
      "cjm_ids": [],
      "flow_nodes": [
        "report-sign",
        "error-entry-save"
      ],
      "user_story_id": "us-15"
    }
  }
}
